,title,isbn,publisher,pubdate,language
423,손에 잡히는 퀀트 투자 with 파이썬 (파이썬을 활용한 금융 데이터 분석과 퀀트 투자 전략 검증),9791158393137,위키북스,20220222,Python
424,"엑셀, R, 파이썬으로 시작하는 데이터 분석 (데이터 분석의 기본 개념과 3가지 핵심 도구 사용법)",9791162245576,한빛미디어,20220429,Python
425,시작북 파이썬 (컬러판),9791137229402,부크크(bookk),20201228,Python
426,구글과 파이썬으로 시작하는 보안 (취약점은 이제 끝! 실전 예제와 코드로 배우는 데이터 보호),9791165920814,비제이퍼블릭,20210831,Python
427,비즈니스 머신러닝 in 파이썬,9791195511747,프레딕스,20200530,Python
428,웹 크롤링 & 데이터 분석 with 파이썬,9788966263394,인사이트,20220124,Python
429,생각대로 파이썬 파이썬 첫걸음 (파이썬 성장 프로젝트 | 파이썬 기초부터 인공지능까지),9791191198027,잇플,20210104,Python
430,파이썬으로 움직이는 EV3 로봇,9791166750502,복두출판사,20210715,Python
431,실무자를 위한 파이썬 100제,9788956748498,정보문화사,20200225,Python
432,"작심 3일 파이썬 Python (모두가 배워야 할 Python, 남몰래 3일만 투자하자!)",9791187431169,스포트라잇북,20190425,Python
433,"파이썬으로 시작하는 데이터 분석 (데이터 분석을 위한 Python 문법부터 데이터 수집, 전처리, 탐색까지)",9791197347023,아이리포,20210715,Python
434,"파이썬으로 배우는 누구나 코딩 (컴퓨팅 사고력을 위한 최적의 파이썬 프로그래밍, 2020년 세종도서 선정)",9791156006916,도서출판 홍릉(홍릉과학출판사),20190826,Python
435,암호 해킹으로 배우는 파이썬의 기초 (암호학과 파이썬을 함께 배우자),9791161753485,에이콘출판,20190731,Python
436,머신러닝을 위한 파이썬 한 조각 (파이썬으로 이해하는 인공지능의 시작),9791190014755,비제이퍼블릭,20200221,Python
437,"파이썬과R(2학기, 워크북포함)",9788920036682,한국방송통신대학교출판문화원,20200725,Python
438,코딩 테스트로 시작하는 파이썬 프로그래밍 (25가지 기출문제 상세 코드 & 개념 강화를 위한 연습문제 수록),9788931466010,영진닷컴,20220425,Python
439,"파이썬을 활용한 머신러닝 쿡북 (전처리에서 딥러닝까지, 판다스와 사이킷런 중심의 실전 문제 해결 200선)",9791162241950,한빛미디어,20190901,Python
440,데이터를 다루며 배우는 파이썬 (Python for Everybody),9788966262489,인사이트,20190822,Python
441,파이썬으로 풀어보는 회귀분석 (단순선형회귀분석부터 고급 회귀분석까지),9791161752501,에이콘출판,20190102,Python
442,진짜 쉽고 쓸모 있는 언어 파이썬 (기초부터 라즈베리 파이로 TV 제어에 주크박스까지!),9788931554502,성안당,20161011,Python
443,파이썬으로 처음 시작하는 코딩 (초보자를 위한 프로그래밍 기본 원리),9791161752259,에이콘출판,20190102,Python
444,파이썬 모의 해킹과 침투 테스팅,9788960777910,에이콘출판,20151126,Python
445,"파이썬으로 배우는 데이터 과학 (파이썬의 주요 패키지부터 머신 러닝, 시각화에 이르기까지)",9791161750910,에이콘출판,20171208,Python
446,"파이썬 데이터 사이언스 핸드북 (IPython, Jupyter, NumPy, Pandas, Matplotlib, Scikit-Learn)",9791158390730,위키북스,20170929,Python
447,"파이썬 3로 컴퓨터 비전 다루기 (이미지 인식, 추적, 기계 학습, 비디오 처리, 컴퓨터 비전 웹서비스)",9791161751061,에이콘출판,20180131,Python
448,파이썬 with 컴퓨팅 사고력,9788955027389,글로벌,20170814,Python
449,주머니 속의 머신러닝 (파이썬으로 구조적 데이터 다루기),9791191600001,제이펍,20210430,Python
450,파이썬으로 배우는 머신러닝 입문 (딥러닝에서 적대적 생성 네트워크까지!),9788931589412,성안당,20210430,Python
451,파이썬으로 시작하는 컴퓨터 프로그래밍,9791156645948,한빛아카데미,20220221,Python
452,파이썬 for Beginner (쉽고 빠르게 익히는 프로그래밍의 기본 원리),9791156644668,한빛아카데미,20200106,Python
453,"파이썬 활용 산업응용수학의 기본 (ELS주가연계증권, 이미지분할, 전염병모델, 대류확산방정식)",9791187541882,지오북스,20200910,Python
454,마야 파이썬 - 3D를 위한 파이썬,9788924064513,퍼플,20190916,Python
455,파이썬으로 배우는 자료구조 프로그래밍,9791189057305,휴먼싸이언스,20220218,Python
456,필수 알고리즘 with 파이썬 (핵심 개념과 실전 문제로 마스터하는),9788931459500,영진닷컴,20181024,Python
457,파이썬을 이용한 빅데이터 분석,9788984686434,21세기사,20181020,Python
458,머신 러닝과 통계 (파이썬과 R로 배우는 머신 러닝),9791161751191,에이콘출판,20180228,Python
459,"파이썬으로 배우는 컴퓨팅사고 (STEAM, 이젠 파이썬으로 코딩한다)",9791195730490,연두에디션,20171215,Python
460,코딩 부트캠프 with 파이썬 (파이썬 기초 문법부터 웹 애플리케이션 제작까지 실습하며 배운다!),9791160503517,길벗,20171211,Python
461,파이썬을 이용한 공학 프로그래밍 (의료용 영상 데이터와 생체 신호 분석을 파이썬으로!),9788931556988,성안당,20210305,Python
462,파이썬을 이용한 딥러닝/강화학습 주식투자 (파이토치와 케라스를 활용한 인공지능 퀀트 투자 시스템),9791158393205,위키북스,20220330,Python
463,"차근차근 실습하며 배우는 파이토치 딥러닝 프로그래밍 (파이썬부터 머신러닝 기초, 이미지 인식, 파인 튜닝까지)",9791158393441,위키북스,20220818,Python
464,Do it! 첫 코딩 with 파이썬 (보통 사람이 알아야 할 프로그래밍 기초),9791163032151,이지스퍼블리싱,20210115,Python
465,파이썬을 이용한 통계적 머신러닝 (제2판),9791158083038,자유아카데미,20210225,Python
466,파이썬 for Beginner (쉽고 빠르게 익히는 프로그래밍의 기본 원리),9791156643593,한빛아카데미,20171130,Python
467,Hello Coding 파이썬 (쌩초보의 처음 프로그래밍),9791162240274,한빛미디어,20180102,Python
468,파이썬을 이용한 알고리즘 트레이딩 (아이디어 도출부터 클라우드 배포까지),9791191600100,제이펍,20210729,Python
469,모두의 파이썬 X 알고리즘(합본호) (누구나 쉽게 배우는 프로그래밍 기초),9791160506631,길벗,20181210,Python
470,파이썬을 활용한 금융공학 레시피 (문과생의 코딩 울렁증과 이과생의 금융 울렁증을 한 방에 씻어줄 금융공학),9791162240823,한빛미디어,20180601,Python
471,"Do it! 파이썬 생활 프로그래밍 (문자열가공, CSV파일처리, 통계분석, 웹크롤링까지 내 손으로 직접 만든다!)",9791163031734,이지스퍼블리싱,20200727,Python
472,파이썬과 함께 배우는 미분방정식,9788924077339,퍼플,20210109,Python
473,파이썬을 이용한 비트코인 자동매매 (실시간 자동매매 시스템 개발 입문),9791196608811,파이스탁,20210322,Python
474,돈 되는 파이썬 인공지능 프로그래밍 (회사 매출을 올리는 AI 도입과 활용법),9791158392574,위키북스,20210617,Python
475,컴퓨팅 사고와 소프트웨어 with 파이썬,9791185578927,인피니티북스,20220302,Python
476,파이썬을 활용한 데이터 분석과 응용,9791158083083,자유아카데미,20210610,Python
477,딥러닝 머신러닝을 위한 파이썬 넘파이 (선형대수를 파이썬으로 이해하기),9791190283878,잇플,20200615,Python
478,파이썬으로 배우는 딥러닝 교과서 (이미지 인식 모델을 만들면서 익히는 딥러닝),9791162242827,한빛미디어,20200301,Python
479,이공학을 위한 파이썬 프로그래밍 (기초에서 이공학 응용까지 한권으로 끝),9788957175231,내하출판사,20200330,Python
480,"파이썬을 이용한 데이터 분석의 정석 (넘파이, 판다스, 맷플롯립과 실전 예제로 배우는)",9791186710708,루비페이퍼,20210625,Python
481,파이썬과 함께 하는 수학 어드벤처 (파이썬과 프로세싱으로 수학 개념 이해하기),9791161753775,에이콘출판,20200115,Python
482,"파이썬으로 배우는 통계학 교과서 (기초 이론부터, 모델, 머신러닝까지)",9791162242452,한빛미디어,20191122,Python
483,파이썬에 참 좋은 PyCharm (나에게 가장 필요한 파이썬 개발 환경 구축하기),9791190014533,비제이퍼블릭,20191031,Python
484,파이썬을 이용한 통계적 머신러닝,9791158082536,자유아카데미,20200220,Python
485,처음 시작하는 파이썬 프로그래밍,9788980782956,가메,20180322,Python
486,실전 스케일링 파이썬 프로그래밍 (오픈 소스 개발자들에게 배우는 대규모 파이썬 개발 노하우),9788966262267,인사이트,20180818,Python
487,알기쉬운 파이썬 SQL 코딩하기 (비전공자도 쉽게 배우는 SQL),9788940646052,크라운출판사,20230110,Python
488,코딩 클럽 LV 3: 제대로 된 파이썬 앱 만들기 (파이썬으로 만드는 게임 프로그램),9788968482335,한빛미디어,20151120,Python
489,코딩 클럽 LV 2: 본격 파이썬 입문 (내가 직접 만드는 파이썬 프로그램),9788968482175,한빛미디어,20150901,Python
490,"파이썬 핵심 개발자들과의 인터뷰 (파이썬 커뮤니티 코어 개발자들이 말하는 파이썬의 과거, 현재 그리고 미래)",9791161340371,터닝포인트,20190121,Python
491,파이썬을 활용한 데이터 길들이기 (데이터 전처리 효율화 전략),9788966264063,인사이트,20170821,Python
492,프로그래밍이 보인다! 파이썬 입문,9788960777682,에이콘출판,20150918,Python
493,파이썬을 사용한 프로그래밍 입문,9788935305292,정익사,20160303,Python
494,프로 안드로이드 SL4A (파이썬으로 안드로이드 앱 만들기),9788994405094,와우북스,20120215,Python
495,알기 쉬운 파이썬 SQL 코딩하기,9788940642320,크라운출판사,20200324,Python
496,김변수와 시작하는 코딩생활 with 파이썬,9788931466003,영진닷컴,20220325,Python
497,"파이썬을 이용한 컴퓨터 과학 입문 (이공계를 위한 프로그래밍, 자료구조, 알고리즘)",9791165210090,길벗,20191230,Python
498,한권으로 파이썬과 드론 날로먹기: 인공지능 편,9791191198096,잇플,20210910,Python
499,"데이터 분석 실무 with 파이썬 (마케팅, 영업, 기획 실무 담당자를 위한 데이터 분석의 기술)",9791158391836,위키북스,20200103,Python
500,모두의 알고리즘 with 파이썬 (컴퓨팅 사고를 위한 기초 알고리즘),9791160501728,길벗,20170518,Python
501,파이썬을 활용한 딥러닝 전이학습 (Transfer Learning으로 빠르고 손쉽게 구축하는 고급 딥러닝 모델),9791158391454,위키북스,20191011,Python
502,파이썬(열혈강의)(개정판 VER.2) (개정판),9788989345770,프리렉,20050829,Python
503,"2022 공개적 빅데이터분석기사 실기 (필수 합격서, 파이썬, 핵심알고리즘 완전 정복)",9791189507589,와이즈인컴퍼니,20220204,Python
504,파이썬 코딩 수학 with 딥러닝 (수학적 사고력 향상을 위한),9788956748351,정보문화사,20190710,Python
505,자연어 처리 쿡북 with 파이썬 (파이썬으로 NLP를 구현하는 60여 가지 레시피),9791161752655,에이콘출판,20190131,Python
506,알고리즘과 자료구조(자바+파이썬) (Java와 Python 예제로 익히는 알고리즘 프로그래밍),9788956747880,정보문화사,20180810,Python
507,파이썬 자연어 처리의 이론과 실제 (효율적인 자연어 처리를 위한 머신 러닝과 딥러닝 구현하기),9791161751726,에이콘출판,20180629,Python
508,코딩 클럽 LV 1: 모두를 위한 파이썬 기초 (저는 코딩도 파이썬도 처음인데요!),9788968482168,한빛미디어,20150901,Python
509,컴퓨팅 사고와 창의적 코딩 (파이썬과 랩터를 활용한 문제해결),9791185578415,인피니티북스,20190225,Python
510,내 일을 바꾸는 업무 자동화 (파이썬 클릭 한 번으로 지겨운 업무 클리어),9788965402749,프리렉,20200612,Python
511,파이썬으로 배우는 자료 구조 핵심 원리 (핵심 개념과 동작 원리로 이해하는 자료 구조),9791165216450,길벗,20210820,Python
512,파이썬을 이용한 데이터 분석 2/e (다양한 파이썬 라이브러리와 소프트웨어를 활용한 데이터 사이언스의 이해),9791161751078,에이콘출판,20180124,Python
513,"파이썬으로 배우는 실전 알고리즘 (물리, 생물, 재무 등 다양한 분야의 응용 예제 구현)",9788965401056,프리렉,20150721,Python
514,모두의 데이터 분석 with 파이썬 (실생활 예제로 시작하는 데이터 분석 첫걸음),9791160507812,길벗,20190425,Python
515,컴퓨터비전과 머신러닝 (파이썬과 OpenCV4를 활용한),9788970934778,광문각,20210225,Python
516,"21개의 작고 재미난 파이썬 프로젝트 (프로그래밍 스킬, 새로운 알고리즘, 테스트 주도 개발을 배우다)",9791191600346,제이펍,20210811,Python
517,파이썬 머신러닝 판다스 데이터 분석,9788956748337,정보문화사,20190615,Python
518,파이썬 웹 프로그래밍 에센셜 개정판 (개정판),9791137235830,부크크(Bookk),20210317,Python
519,컴퓨팅 사고 (문제해결 중심의 파이썬 프로그래밍),9791185578439,인피니티북스,20200212,Python
520,파이썬ㆍ케라스로 시작하는 AI기초 (구글 코랩 활용),9791166750519,복두출판사,20210715,Python
521,데이터 분석을 위한 파이썬 철저 입문 (기초 문법부터 실무에 필요한 데이터 분석 기술까지 한 번에 배우는),9791158391522,위키북스,20190425,Python
522,인공지능 (파이썬으로 배우는 머신러닝과 딥러닝),9791185578606,인피니티북스,20200212,Python
523,왕초보! 파이썬 배워 크롤러 DIY 하다!,9791195484720,더알음,20160316,Python
524,코드업과 함께 하는 파이썬 & 문제 해결 (누구나 쉽게 배우는 프로그래밍 입문서),9788958973874,삼양미디어,20201120,Python
525,파이썬 데이터 전처리 및 탐색 라이브러리,9791137257726,부크크(bookk),20211022,Python
526,배워서 바로 써먹는 데이터 분석 with 파이썬,9788970505404,생능북스,20220415,Python
527,IT 비전공자를 위한 돈 버는 파이썬 코딩 (N잡러 자동부업 수익창출),9788960883802,디지털북스,20211010,Python
528,빠르게 활용하는 파이썬 3.2 프로그래밍 (개정증보판),9788992939409,위키북스,20120412,Python
529,모두의 엔트리 with 엔트리파이썬 (코딩! 블록으로 이해하고 파이썬 코드로 익힌다),9791160503401,길벗,20171120,Python
530,"파이썬으로 배우는 게임 개발: 실전편 (장애물 피하기, 닷잇 액션, 맵 에티터, 탄막 슈팅)",9791190665452,제이펍,20201120,Python
531,"파이썬으로 배우는 게임 개발: 입문편 (퀴즈, 주사위, 제비 뽑기, 미로, 진단 애플리케이션, 블록 낙하 퍼즐, RPG 등을 만들며 배운다!)",9791190665445,제이펍,20201026,Python
532,난생처음 컴퓨팅 사고 with 파이썬,9791156645214,한빛아카데미,20210105,Python
533,파이썬과 케라스로 배우는 강화학습 (내 손으로 직접 구현하는 게임 인공지능),9791158392017,위키북스,20200407,Python
534,"파이썬으로 배우는 수치 데이터 처리 (AI, Deep Learning, BigData 처리를 위한 PYTHON 필수 라이브러리 기초)",9788980783069,가메,20200303,Python
535,"일잘러의 비밀, 엑셀 대신 파이썬으로 업무 자동화하기 (엑셀 반복 업무로 지친 직장인, 파이썬으로 칼퇴하자)",9791162245569,한빛미디어,20220425,Python
536,The Python - 파이썬 프로그래밍,9791137255647,부크크(bookk),20210909,Python
537,파이썬을 이용한 웹크롤링과 데이터 분석,9791185578910,인피니티북스,20210908,Python
538,"파이썬으로 데이터 마이닝 시작하기 (데이터의 수집, 로딩, 변환, 클러스터링, 예측까지)",9791161753669,에이콘출판,20191219,Python
539,효율적 개발로 이끄는 파이썬 실천 기술 (파이썬에 숨겨진 힘을 이용해 개발 효율을 높이자!),9791190665872,제이펍,20210419,Python
540,파이썬으로 완성하는 비지도 학습 알고리즘 (비감독 모형과 텐서플로 2를 이용한 전처리 기법의 머신러닝 구현),9791165921101,비제이퍼블릭,20211130,Python
541,배프의 오지랖 파이썬 웹프로그래밍 (Django(장고)로 쉽게 배우는),9788960882485,디지털북스,20190305,Python
542,파이썬으로 배우는 프로그래밍 기초 (소프트웨어 교양 | 누구나 할 수 있는 가장 쉬운 프로그래밍 입문서),9788968484940,한빛아카데미,20160818,Python
543,Getting Start Python (파이썬 입문부터 응용까지 활용가능!),9791158136925,구민사,20190425,Python
544,파이썬과 함께 배우는 신호와 시스템 (개정판),9791156007432,도서출판 홍릉(홍릉과학출판사),20200309,Python
545,코딩마법서 1: Stone Version(해법서포함) (코딩테스트와 인공지능을 위한 파이썬),9791197008412,오일러BOOKS,20210401,Python
546,"Python Programming for Beginners (개념을 꼼꼼하게, 파이썬 프로그래밍)",9788960777859,에이콘출판,20151119,Python
547,Black Hat Python (해커와 모의 침투 연구자를 위한 파이썬 프로그래밍),9791161756356,에이콘출판,20220430,Python
548,딥러닝 데이터 전처리 입문 (파이썬과 R로 배우는 데이터 다루기),9791161751580,에이콘출판,20180524,Python
549,파이썬으로 배우는 프로그래밍 기초 (거북이 그래픽으로 따라하는 재미있는 코딩),9791185578361,인피니티북스,20180227,Python
550,Getting Start Python (파이썬 입문부터 응용까지 활용 가능!),9791158132651,구민사,20160610,Python
551,파이썬으로 배우는 초중등 교과서 1 (즐겁게 시작하고 똑똑하게 끝내는 코딩 교과서),9791186710517,루비페이퍼,20190816,Python
552,파이썬으로 배우는 초중등 교과서 2 (즐겁게 시작하고 똑똑하게 끝내는 코딩 교과서),9791186710494,루비페이퍼,20190820,Python
553,파이썬으로 배우는 응용 텍스트 분석 (언어 인식 데이터 제품 개발을 위한 머신러닝),9791188621774,제이펍,20191129,Python
554,파이썬 날코딩으로 알고 짜는 딥러닝 (프레임워크 없이 단층 퍼셉트론에서 GAN까지),9791162242001,한빛미디어,20190715,Python
555,마인크래프트와 함께 즐겁게 파이썬 (게임으로 재미있게 배우는 코딩과 알고리즘),9791186697733,비제이퍼블릭,20181130,Python
556,파이썬을 활용한 스파크 프로그래밍 (빅데이터 분석을 위한 스파크 활용법),9791161753287,에이콘출판,20190828,Python
557,머신 러닝 알고리즘 (파이썬 예제와 함께 배우는 머신 러닝),9791161752778,에이콘출판,20190228,Python
558,초등 교과수학코딩 with 파이썬,9791127273330,부크크(Bookk),20190531,Python
559,"파이썬을 활용한 부동산 데이터 분석 (파이썬 기초부터 실제 부동산 데이터를 활용한 매매분석, 수요예측, 시각화)",9791158391546,위키북스,20190516,Python
560,파이썬으로 배우는 대규모 머신 러닝 (대규모 데이터 분석과 처리를 위한 다양한 머신 러닝 기법 활용),9791161750224,에이콘출판,20170710,Python
561,파이썬과 케라스로 배우는 강화학습 (내 손으로 직접 구현하는 게임 인공지능),9791158390723,위키북스,20170731,Python
562,파이썬으로 구현하는 고급 머신 러닝 (딥러닝을 포함한 최신 고급 머신 러닝 기술과 파이썬 활용),9791161750354,에이콘출판,20170817,Python
563,파이썬을 이용한 비트코인 자동매매 (실시간 자동매매 시스템 개발 입문),9791196608804,파이스탁,20190218,Python
564,암호화폐 자동매매 시스템 만들기 with 파이썬 (대량의 시뮬레이션과 최적화 전략까지),9788997924967,로드북,20220302,Python
565,"머신 러닝 부트캠프 with 파이썬 (분류, 회귀 구현 방법과 실전 예제를 통해 제대로 된 학습 방법을 배운다!)",9791160504842,길벗,20180531,Python
566,파이썬 GUI 프로그래밍 쿡북 2/e (파이썬 3로 쉽고 빠르게 GUI 개발하기),9791161751474,에이콘출판,20180426,Python
567,예제로 배우는 파이썬 데이터 시각화 (파이썬초심자부터다양한데이터시각화예제학습이필요한독자들을위한필독서),9791161750040,에이콘출판,20170612,Python
568,Head First Python (머리에 쏙쏙 들어오는 파이썬 안내서),9788968482724,한빛미디어,20160320,Python
569,Python (머리에 쏙쏙 들어오는 파이썬 안내서),9788979148688,한빛미디어,20111028,Python
570,HEAD FIRST PROGRAMMING (파이썬으로 처음배우는 프로그래밍),9788979148190,한빛미디어,20110325,Python
571,"파이썬 기초의 모든 것, 14개의 코딩 이야기!",9788909202831,교학사,20180420,Python
572,초보자도 간단히 단숨에 배우는 파이썬 (쉽게 빠르게 편하게 시작하는 프로그래밍 입문),9791161340654,터닝포인트,20200413,Python
573,파이썬을 활용한 소프트웨어 아키텍처 (견고하고 확장 가능한 애플리케이션 아키텍처 설계),9791161754857,에이콘출판,20210104,Python
574,파이썬 딥러닝으로 시작하는 이상 징후 탐지 (한국어판),9791156008781,홍릉,20210924,Python
575,"파이썬 데이터 분석 실무 테크닉 100 (100가지 예제로 배우는 데이터 가공, 머신러닝, 이미지/자연어 처리의 기술)",9791158392178,위키북스,20200730,Python
576,잡아라! 텍스트 마이닝 with 파이썬 (지금 바로 할 수 있는 데이터 추출과 분석),9791186697788,비제이퍼블릭,20190430,Python
577,데이터 과학 기반의 파이썬 빅데이터 분석,9791156645078,한빛아카데미,20201230,Python
578,The Python 3 Standard Library by Example (예제로 배우는 파이썬 표준 라이브러리),9791161754307,에이콘출판,20200630,Python
579,파이썬 기반의 Natural 컴퓨팅,9791156007494,도서출판 홍릉(홍릉과학출판사),20200420,Python
580,인공지능 100점을 위한 파이썬 수학 (고등학교 수학으로 이해하는 인공지능),9791190014861,비제이퍼블릭,20200429,Python
581,파이썬(Python) 2학년 스크래핑의 구조 (체험으로 배우고! 대화 형식으로 공부!),9788931556896,성안당,20211117,Python
582,파이썬으로 배우는 자연어 처리 인 액션,9791190665018,제이펍,20200304,Python
583,"Hello 실전 파이썬 프로그래밍 world (게임 개발, 데이터 분석, 인공지능 제어까지 학습하는)",9791167640079,혜지원,20220114,Python
584,파이썬으로 배우는 소프트웨어 디자인 (디자인 사고 및 컴퓨팅 사고의 이해와 응용),9791185578613,인피니티북스,20200227,Python
585,유쾌한 코딩 (파이썬으로 시작하는 프로그래밍 기초),9791185578651,인피니티북스,20200313,Python
586,파이썬으로 다시 배우는 핵심 고등 수학 (수포자 프로그래머를 위한 손에 잡히는 기초 수학),9791158391775,위키북스,20191107,Python
587,바이오파이썬으로 만나는 생물정보학 (파이썬 프로그래밍을 통해 풀어보는 생명의 구조),9791186697818,비제이퍼블릭,20190322,Python
588,누구나 파이썬 너도 데이터 가지고 놀 수 있어! 1 (독특하고 재이있는 예제로 파이썬을 시작하고 싶다면),9791190283670,잇플,20200124,Python
589,모두의 라즈베리파이 with 파이썬 (누구나 쉽게 배우는 전자 회로 공작과 사물 인터넷 파이썬 프로그래밍),9791160507027,길벗,20190120,Python
590,파이썬으로 시작하는 라즈베리파이 3 (개정판),9791159063541,복두출판사,20180306,Python
591,"Try! Helloworld 파이썬 (하루 15분, 누구나 프로그래밍을 할 수 있다!)",9791160501063,길벗,20170215,Python
592,파이썬을 활용한 네트워크 프로그래밍 (개발자와 관리자를 위한 효율적인 네트워크 애플리케이션 개발),9788960776432,에이콘출판,20150127,Python
593,파이썬으로 시작하는 컴퓨터 과학 입문,9788966264087,인사이트,20170818,Python
594,파이썬으로 배우는 수학적 프로그래밍 (이산 수학의 개념과 구조를 활용한 효율적 사고),9788965401049,프리렉,20150827,Python
595,코어 파이썬 애플리케이션 프로그래밍,9788960775213,에이콘출판,20140129,Python
596,보통의 취준생을 위한 코딩 테스트 with 파이썬 (백준 플래티넘 5 &코드포스 파란색 랭크 달성하기),9788997924950,로드북,20220223,Python
597,"핸즈온 파이썬을 이용한 설명가능한 AI(XAI) (공정하고, 안전하며, 믿을 수 있는 AI 애플케이션을 위한, 신뢰할 만한 AI 해석, 시각화 설명 및 통합핸즈온)",9791196965662,DK로드북스,20220110,Python
598,컴퓨팅 사고력을 키우는 SW 교육: 파이썬 (컴퓨팅 사고력을 키우는 SW 교육),9791156642701,한빛아카데미,20160720,Python
599,누구나 파이썬 너도 데이터 가지고 놀 수 있어! 1 (너도 데이터 가지고 놀 수 있어!),9791196707903,토마토북,20190617,Python
600,모의 침투 입문자를 위한 파이썬 3 활용 (파이썬 3 기반의 TCP/IP 활용 지침서),9791161753973,에이콘출판,20200228,Python
601,파이썬과 주피터 노트북 기반의 SAS Viya,9791158083304,자유아카데미,20211020,Python
